{
  "content_id": "greg-sys-retry-exhausted-01",
  "brand": "acme-cosmos",
  "platform": "twitter",
  "format": "text",
  "mode": "LIVE",
  "created_at": "2026-01-01T09:00:00.000Z",
  "state": "failed_handoff",
  "state_updated_at": "2026-01-01T09:30:00.000Z",
  "approved_by": "reviewer-1",
  "approved_variant": "recommended",
  "approved_at": "2026-01-01T09:05:00.000Z",
  "package_ref": "workspaces/packaged/greg-sys-retry-exhausted-01.package.json",
  "attempt_count": 3,
  "publish_intent": "intent-greg-sys-retry-exhausted-01",
  "error": "publisher handoff failed (502) on attempt 3",
  "hold_reason": "retry bound (3, DD-13) exhausted"
}
